<?xml version="1.0" encoding="UTF-8"?>
<!--Sample XML file generated by XMLSpy v2006 rel. 3 sp1 (http://www.altova.com)-->
<n:administrative-division xmlns:n="http://www.softproject.com.pl/commons-administrative-division" xmlns:xsi="http://www.w3.org/2001/XMLSchema-instance" xsi:schemaLocation="http://www.softproject.com.pl/commons-administrative-division
http://schema.softproject.com.pl/commons-dictionary/administrative-division.xsd">
	<province name="Mazowieckie">
		<district name="Warszawski Zachodni">
			<community name="Łomianki" teryc="143205" type="miejsko-wiejska"/>
			<community name="Błonie" teryc="143201" type="miejsko-wiejska"/>
			<community name="Izabelin" teryc="143202" type="wiejska"/>
			<community name="Kampinos" teryc="143203" type="wiejska"/>
			<community name="Leszno" teryc="143204" type="wiejska"/>
			<community name="Ożarów Mazowiecki" teryc="143206" type="miejsko-wiejska"/>
			<community name="Stare Babice" teryc="143207" type="wiejska"/>
		</district>
		<district name="Sokołowski">
			<community name="Sokołów Podlaski" teryc="142901" type="miejska"/>
			<community name="Bielany" teryc="142902" type="wiejska"/>
			<community name="Ceranów" teryc="142903" type="wiejska"/>
			<community name="Jabłonna Lacka" teryc="142904" type="wiejska"/>
			<community name="Kosów Lacki" teryc="142905" type="miejsko-wiejska"/>
			<community name="Repki" teryc="142906" type="wiejska"/>
			<community name="Sabnie" teryc="142907" type="wiejska"/>
			<community name="Sokołów Podlaski" teryc="142908" type="wiejska"/>
			<community name="Sterdyń" teryc="142909" type="wiejska"/>
		</district>		
	</province>
	<province name="Podkarpackie">
		<district name="Bieszczadzki">
			<community name="Czarna" teryc="180103" type="wiejska"/>
			<community name="Lutowiska" teryc="180105" type="wiejska"/>
			<community name="Ustrzyki Dolne" teryc="180108" type="miejsko-wiejska"/>
		</district>
		<district name="m. Rzeszów">
			<community name="M. Rzeszów" type="powiat-grodzki" teryc="186301"/>
		</district>
	</province>
</n:administrative-division>
